{
  "message_id": "0003",
  "task_id": "TASK-20260101-001",
  "from": "claude",
  "to": "codex",
  "type": "review_response",
  "created_at": "2026-01-01T10:32:00Z",
  "in_reply_to": "0002",
  "summary": "1 issue found",
  "body": {
    "verdict": "changes_requested",
    "findings": [
      {
        "severity": "high",
        "file": "src/auth/login.ts",
        "issue": "Retries include non-retriable authentication failures",
        "recommendation": "Restrict retries to timeout and network failures only"
      }
    ],
    "approved_head_commit": null
  },
  "status": "open"
}
